{
  "$schema": "../schemas/scoring-benchmark.schema.json",
  "schema_version": "1.0",
  "description": "Labeled scoring benchmark cases. Each case defines the expected tier and the concrete evidence labels that explain why the tier is correct.",
  "require_expected_decisions": true,
  "cases": [
    {
      "id": "public-request-controlled-sensitive",
      "description": "Public request-controlled vulnerable path with sensitive IAM should be urgent.",
      "artifact": "payments-api",
      "component": {"name": "log4j-core", "version": "2.14.1", "scope": "runtime"},
      "vulnerability": {"id": "CVE-2021-44228", "package_name": "log4j-core", "cvss": 10.0, "known_exploited": true},
      "source": {"reachability": "attacker_controlled", "confidence": "high"},
      "context": {"exposure": "public", "environment": "prod", "privilege": "sensitive", "iam_impacts": ["data_access"], "confidence": "medium"},
      "expected_tier": "urgent",
      "expected_decision": {
        "why": "Urgent because a known exploited critical vulnerability is request-controlled on a public production service with sensitive data-access privileges.",
        "required_reason_labels": ["tier:urgent", "severity:critical", "exploit:known_exploited", "source:attacker_controlled", "network:public", "iam:sensitive", "iam_impact:data_access"]
      },
      "min_score": 85,
      "max_score": 100
    },
    {
      "id": "public-request-controlled-no-critical-context",
      "description": "Public request-controlled vulnerable path without critical IAM should stay high unless exploit intelligence is stronger.",
      "artifact": "frontend",
      "component": {"name": "express", "version": "4.17.1", "scope": "runtime"},
      "vulnerability": {"id": "GHSA-express", "package_name": "express", "cvss": 7.5},
      "source": {"reachability": "attacker_controlled", "confidence": "high"},
      "context": {"exposure": "public", "environment": "prod", "privilege": "none", "confidence": "medium"},
      "expected_tier": "high",
      "expected_decision": {
        "why": "High because public request-controlled code is affected by a high-severity vulnerability, but there is no exploit intelligence or critical IAM blast radius to justify urgent.",
        "required_reason_labels": ["tier:high", "severity:high", "source:attacker_controlled", "network:public", "iam:none"]
      },
      "min_score": 65,
      "max_score": 84
    },
    {
      "id": "public-request-controlled-auth-constrained",
      "description": "Auth or WAF constraints reduce public exposure weight and keep non-exploited findings below urgent until the path is proven attacker reachable.",
      "artifact": "edge-api",
      "component": {"name": "router", "version": "1.0.0", "scope": "runtime"},
      "vulnerability": {"id": "GHSA-router", "package_name": "router", "cvss": 9.8},
      "source": {"reachability": "attacker_controlled", "confidence": "high"},
      "context": {
        "exposure": "public",
        "environment": "prod",
        "privilege": "sensitive",
        "network_paths": [{"confidence": "medium", "blockers": [{"kind": "auth_required", "effect": "constrains"}]}],
        "confidence": "medium"
      },
      "expected_tier": "high",
      "expected_decision": {
        "why": "High because the vulnerable path is public and request-controlled, but auth/WAF evidence constrains the path and caps the score below urgent.",
        "required_reason_labels": ["tier:high", "severity:critical", "source:attacker_controlled", "network:public", "network_blocker:constrains", "gate:network_blocker:capped"]
      },
      "min_score": 79,
      "max_score": 84
    },
    {
      "id": "public-path-blocked-by-private-endpoint",
      "description": "A confirmed network blocker prevents a public signal from being scored as confirmed exposure.",
      "artifact": "private-api",
      "component": {"name": "parser", "version": "1.0.0", "scope": "runtime"},
      "vulnerability": {"id": "GHSA-parser", "package_name": "parser", "cvss": 9.8},
      "source": {"reachability": "function_reachable", "confidence": "high"},
      "context": {
        "exposure": "public",
        "environment": "prod",
        "privilege": "sensitive",
        "network_paths": [{"confidence": "medium", "blockers": [{"kind": "public_network_disabled", "effect": "blocks"}]}],
        "confidence": "medium"
      },
      "expected_tier": "medium",
      "expected_decision": {
        "why": "Medium because a confirmed private-endpoint blocker removes the public exposure contribution, leaving reachable code and sensitive IAM below high.",
        "required_reason_labels": ["tier:medium", "severity:critical", "source:function_reachable", "network_blocker:blocks", "gate:network_blocker:capped", "iam:sensitive"]
      },
      "min_score": 60,
      "max_score": 64
    },
    {
      "id": "low-confidence-iam-critical-context",
      "description": "Low-confidence IAM effective access contributes uncertainty and should not make a non-exploited finding urgent.",
      "artifact": "ops-api",
      "component": {"name": "serializer", "version": "1.0.0", "scope": "runtime"},
      "vulnerability": {"id": "GHSA-serializer", "package_name": "serializer", "cvss": 9.8},
      "source": {"reachability": "function_reachable", "confidence": "high"},
      "context": {
        "exposure": "external",
        "environment": "prod",
        "privilege": "none",
        "iam_impacts": ["data_access"],
        "effective_access": [{"effect": "allow", "impact": "data_access", "confidence": "low"}],
        "confidence": "medium"
      },
      "expected_tier": "high",
      "expected_decision": {
        "why": "High because the finding is critical and externally reachable, but the IAM allow is low confidence and must not be treated as confirmed urgent blast radius.",
        "required_reason_labels": ["tier:high", "severity:critical", "source:function_reachable", "network:external", "iam_confidence:low", "gate:low_confidence_iam:passed"]
      },
      "min_score": 75,
      "max_score": 84
    },
    {
      "id": "private-function-reachable-no-blast-radius",
      "description": "Private function-reachable finding without exploit signal or critical context should stay below high.",
      "artifact": "batch-worker",
      "component": {"name": "lodash", "version": "4.17.20", "scope": "runtime"},
      "vulnerability": {"id": "CVE-2021-23337", "package_name": "lodash", "cvss": 7.5, "epss": 0.22},
      "source": {"reachability": "function_reachable", "confidence": "medium"},
      "context": {"exposure": "private", "environment": "prod", "privilege": "none", "confidence": "medium"},
      "expected_tier": "medium",
      "expected_decision": {
        "why": "Medium because the vulnerable function is reachable in private production code, with no public ingress, critical privilege, or strong exploit signal.",
        "required_reason_labels": ["tier:medium", "severity:high", "source:function_reachable", "network:private", "iam:none", "gate:private_no_ingress:passed"]
      },
      "min_score": 40,
      "max_score": 64
    },
    {
      "id": "internal-import-only-critical-iam",
      "description": "Internal import-only finding with critical IAM remains capped below high until stronger code evidence exists.",
      "artifact": "ops-api",
      "component": {"name": "requests", "version": "2.19.0", "scope": "runtime"},
      "vulnerability": {"id": "GHSA-requests", "package_name": "requests", "cvss": 9.1},
      "source": {"reachability": "imported", "confidence": "medium"},
      "context": {"exposure": "internal", "environment": "prod", "privilege": "sensitive", "iam_impacts": ["network_control"], "confidence": "medium"},
      "expected_tier": "medium",
      "expected_decision": {
        "why": "Medium because the service is internal and only import-level code evidence exists; critical IAM impact is visible but import-only evidence is capped below high.",
        "required_reason_labels": ["tier:medium", "severity:critical", "source:imported", "network:internal", "iam_impact:network_control", "gate:import_only_evidence:capped"]
      },
      "min_score": 40,
      "max_score": 64
    },
    {
      "id": "weak-source-known-exploited",
      "description": "Known exploited vulnerability with weak source evidence can be high but not urgent.",
      "artifact": "legacy-api",
      "component": {"name": "struts2-core", "version": "2.3.31", "scope": "runtime"},
      "vulnerability": {"id": "CVE-2017-5638", "package_name": "struts2-core", "cvss": 10.0, "known_exploited": true},
      "source": {"reachability": "package_present", "confidence": "low"},
      "context": {"exposure": "public", "environment": "prod", "privilege": "none", "confidence": "medium"},
      "expected_tier": "high",
      "expected_decision": {
        "why": "High because known exploitation and critical severity matter on a public service, but SBOM-only source evidence is weak and keeps the finding below urgent.",
        "required_reason_labels": ["tier:high", "severity:critical", "exploit:known_exploited", "source:weak", "network:public", "gate:weak_source_evidence:passed"]
      },
      "min_score": 65,
      "max_score": 84
    },
    {
      "id": "public-dependency-graph-critical-context",
      "description": "Indirect dependency evidence can be high for public critical context but remains below urgent.",
      "artifact": "edge-api",
      "component": {"name": "transitive-http", "version": "1.0.0", "scope": "runtime"},
      "vulnerability": {"id": "GHSA-transitive", "package_name": "transitive-http", "cvss": 9.8},
      "source": {"reachability": "dependency_reachable", "confidence": "medium"},
      "context": {"exposure": "public", "environment": "prod", "privilege": "sensitive", "iam_impacts": ["data_access"], "confidence": "medium"},
      "expected_tier": "high",
      "expected_decision": {